paper_runs/ga_uniform_dim68_pop40_gens40_procW18/ga_uniform_finished2025-10-28_14-36-07/ga_uniform_dim68_pop40_gens40_procW18_eval_agg.csv

seed,fitness_mean,fitness_std,total_score_mean,total_score_std,accuracy_mean,accuracy_std,hits_mean,hits_std,deaths_mean,deaths_std,sec_mean,sec_std
0,321.11504424778764,0.0,,,0.9911504424778762,1.3597399555105182e-16,226.0,0.0,2.0,0.0,18.328676064809162,0.22397873891662434
1,308.14814814814815,0.0,,,0.9814814814814815,0.0,214.0,0.0,2.0,0.0,17.550899902979534,0.27827535484543403
2,337.41434262948206,0.0,,,0.9641434262948207,0.0,243.0,0.0,1.0,0.0,17.917221705118816,0.17552077982781053

paper_runs/ga_uniform_dim68_pop40_gens40_procW18/report.md

# Automated Documentation Report

**Evaluation per seed**:
- seed 0: fitness_mean=321.115±0.000, score_mean=nan±nan, acc_mean=0.991±0.000, hits_mean=226.000±0.000, deaths_mean=2.000±0.000
- seed 1: fitness_mean=308.148±0.000, score_mean=nan±nan, acc_mean=0.981±0.000, hits_mean=214.000±0.000, deaths_mean=2.000±0.000
- seed 2: fitness_mean=337.414±0.000, score_mean=nan±nan, acc_mean=0.964±0.000, hits_mean=243.000±0.000, deaths_mean=1.000±0.000