paper_runs/de_dim68_pop40_gens40_procW18/de_finished2025-10-29_08-43-10/de_dim68_pop40_gens40_procW18_eval_agg.csv

seed,fitness_mean,fitness_std,total_score_mean,total_score_std,accuracy_mean,accuracy_std,hits_mean,hits_std,deaths_mean,deaths_std,sec_mean,sec_std
0,313.33333333333337,0.0,,,0.9733333333333333,1.3597399555105182e-16,222.0,0.0,3.0,0.0,19.97719168663025,0.46609302743705
1,329.3050847457627,0.0,,,0.9830508474576272,0.0,233.0,0.0,1.0,0.0,19.359156767527264,0.06708450036679789
2,340.99196787148594,0.0,,,0.9799196787148595,1.3597399555105182e-16,245.0,0.0,1.0,0.0,15.585426568984985,0.14476806191340452

paper_runs/de_dim68_pop40_gens40_procW18/report.md

# Automated Documentation Report

**Evaluation per seed**:
- seed 0: fitness_mean=313.333±0.000, score_mean=nan±nan, acc_mean=0.973±0.000, hits_mean=222.000±0.000, deaths_mean=3.000±0.000
- seed 1: fitness_mean=329.305±0.000, score_mean=nan±nan, acc_mean=0.983±0.000, hits_mean=233.000±0.000, deaths_mean=1.000±0.000
- seed 2: fitness_mean=340.992±0.000, score_mean=nan±nan, acc_mean=0.980±0.000, hits_mean=245.000±0.000, deaths_mean=1.000±0.000