paper_runs/ga_sbx_dim68_pop4_gens4_procW18/ga_sbx_finished2025-10-28_08-26-20/ga_sbx_dim68_pop4_gens4_procW18_eval_agg.csv

seed,fitness_mean,fitness_std,total_score_mean,total_score_std,accuracy_mean,accuracy_std,hits_mean,hits_std,deaths_mean,deaths_std,sec_mean,sec_std
0,251.125,0.0,,,0.9812499999999998,1.3597399555105182e-16,161.0,0.0,4.0,0.0,12.211993296941122,0.19708346531118667
1,233.22222222222226,3.4809342861069267e-14,,,0.9722222222222222,0.0,144.0,0.0,4.0,0.0,33.4429779847463,0.1963548215734283
2,270.87005649717514,0.0,,,0.9887005649717514,0.0,178.0,0.0,3.0,0.0,21.305858771006267,0.1605566295619052

paper_runs/multi_run_finished2025-10-28_08-26-20/report.md

# Automated Documentation Report

**Evaluation per seed**:
- seed 0: fitness_mean=251.125±0.000, score_mean=nan±nan, acc_mean=0.981±0.000, hits_mean=161.000±0.000, deaths_mean=4.000±0.000
- seed 1: fitness_mean=233.222±0.000, score_mean=nan±nan, acc_mean=0.972±0.000, hits_mean=144.000±0.000, deaths_mean=4.000±0.000
- seed 2: fitness_mean=270.870±0.000, score_mean=nan±nan, acc_mean=0.989±0.000, hits_mean=178.000±0.000, deaths_mean=3.000±0.000